{
  "$schema": "http://json-schema.org/draft-07/schema#",
  "title": "Omelette Brunch Menu Schema",
  "type": "object",
  "properties": {
    "menu_title": { "type": "string" },
    "supply_time": { "type": "string" },
    "categories": {
      "type": "array",
      "items": {
        "type": "object",
        "properties": {
          "title": { "type": "string" },
          "items": {
            "type": "array",
            "items": {
              "type": "object",
              "properties": {
                "name": { "type": "string" },
                "price": { "type": "number" },
                "options": {
                  "type": "array",
                  "items": { "type": "string" },
                  "nullable": true,
                  "description": "Optional. If present, will be rendered as a parenthetical list after the item name, e.g. 荷包蛋 (半熟/全熟)."
                },
                "is_new": { "type": "boolean" },
                "is_recommended": { "type": "boolean" }
              },
              "required": ["name", "price"]
            }
          },
          "side_dish_options": {
            "type": "array",
            "items": { "type": "string" },
            "nullable": true
          },
          "add_ons": {
            "type": "array",
            "items": {
              "type": "object",
              "properties": {
                "name": { "type": "string" },
                "price": { "type": "number" }
              },
              "required": ["name", "price"]
            },
            "nullable": true
          },
          "note": { "type": "string", "nullable": true },
          "is_new": { "type": "boolean" },
          "is_recommended": { "type": "boolean" }
        },
        "required": ["title", "items"]
      }
    },
    "set_options": {
      "type": "object",
      "properties": {
        "items": {
          "type": "array",
          "items": {
            "type": "object",
            "properties": {
              "name": { "type": "string" },
              "extra_price": { "type": "number" },
              "content": {
                "type": "array",
                "items": { "type": "string" }
              },
              "save": { "type": "number" }
            },
            "required": ["name", "extra_price", "content", "save"]
          }
        },
        "notes": {
          "type": "array",
          "items": { "type": "string" },
          "nullable": true
        }
      },
      "required": ["items"]
    },
    "drinks": {
      "type": "array",
      "items": {
        "type": "object",
        "properties": {
          "name": { "type": "string" },
          "temperature": {
            "type": "array",
            "items": { "type": "string" }
          },
          "size": {
            "type": "array",
            "items": {
              "type": "object",
              "properties": {
                "label": { "type": "string" },
                "price": { "type": "number" }
              },
              "required": ["label", "price"]
            }
          },
          "notes": { "type": "string", "nullable": true }
        },
        "required": ["name", "temperature", "size"]
      }
    },
    "notes": {
      "type": "array",
      "items": { "type": "string" }
    },
    "contact": {
      "type": "object",
      "properties": {
        "address": { "type": "string" },
        "phone": { "type": "string" }
      },
      "required": ["address", "phone"]
    },
    "social": {
      "type": "array",
      "items": {
        "type": "object",
        "properties": {
          "platform": { "type": "string" },
          "name": { "type": "string" }
        },
        "required": ["platform", "name"]
      }
    }
  },
  "required": ["menu_title", "supply_time", "categories", "set_options", "drinks", "notes", "contact", "social"]
} 